{
  "$schema": "schema/risks.schema.json",
  "id": "risks",
  "title": "Risks",
  "summary": "What could go wrong, how likely and how bad (1 = low, 5 = high), what we do about it, and which phase checks it.",
  "items": [
    {
      "id": "risk-r01",
      "title": "Tauri cannot yet give each site its own profile",
      "summary": "Sites are to be kept apart by separate WebView2 profiles, but a profile can only be set when a web view is created, and Tauri does not pass it through yet.",
      "likelihood": 4,
      "impact": 4,
      "mitigation": "Tested in P1: creating the tab views ourselves gives each site its own profile in one shared browser (experiment 2). You choose the route; then the risk can close.",
      "phase": "phase-p1-foundation",
      "status": "Being reduced",
      "category": "Security & privacy",
      "tags": [
        "isolation",
        "Tauri"
      ],
      "related": [
        "phase-p1-foundation",
        "phase-p3-tabs-sessions",
        "phase-p4-security",
        "adr-0010",
        "adr-0007",
        "risk-r02",
        "risk-r09"
      ],
      "source": {
        "wiki_path": "wiki/risks/risk-r01-webview2-profile-at-creation.md",
        "content_hash": "sha256:c80a839773a57007591d9882b230cad16bb63edf6d20633a20cffb0f43b56da6"
      }
    },
    {
      "id": "risk-r02",
      "title": "Multi-view feature may be unstable",
      "summary": "Many web views in one window needs a Tauri feature marked experimental. Known bugs: hangs, blank views, lost keyboard focus.",
      "likelihood": 4,
      "impact": 4,
      "mitigation": "Tested in P1: create views only from background code, keep the shell above the tabs (tabs always draw on top). Your Alt+Tab and copy-paste checks finish the test.",
      "phase": "phase-p1-foundation",
      "status": "Being reduced",
      "category": "The app",
      "tags": [
        "web views",
        "Tauri"
      ],
      "related": [
        "phase-p1-foundation",
        "phase-p2-minimal-container",
        "phase-p3-tabs-sessions",
        "adr-0007",
        "adr-0006",
        "risk-r01",
        "risk-r20"
      ],
      "source": {
        "wiki_path": "wiki/risks/risk-r02-tauri-multiwebview-unstable.md",
        "content_hash": "sha256:d7b44f8408bbb17b97e5670628d29ca3015a610a8e8f5b0c05f4ffa042036673"
      }
    },
    {
      "id": "risk-r03",
      "title": "Tab sleep and memory saving need unsafe low-level code",
      "summary": "The WebView2 calls that put a tab to sleep or ask it to use less memory are not in Tauri, so we must reach them through unsafe code. Sleep can also simply fail.",
      "likelihood": 5,
      "impact": 3,
      "mitigation": "Tested in P1: every needed engine call works through Tauri. All low-level code stays in one module with written safety rules.",
      "phase": "phase-p7-lifecycle",
      "status": "Being reduced",
      "category": "The app",
      "tags": [
        "tab sleeping",
        "WebView2"
      ],
      "related": [
        "phase-p1-foundation",
        "phase-p7-lifecycle",
        "risk-r18",
        "risk-r23",
        "risk-r20"
      ],
      "source": {
        "wiki_path": "wiki/risks/risk-r03-raw-com-lifecycle-apis.md",
        "content_hash": "sha256:da9a7b32286c8d3065325e81a93c9edf410493d5097625f94b98239962174858"
      }
    },
    {
      "id": "risk-r04",
      "title": "AMD energy readings may be estimates",
      "summary": "Research suggests AMD's energy counters are modelled rather than measured, cover only the CPU chip, and need admin rights plus a kernel driver.",
      "likelihood": 5,
      "impact": 4,
      "mitigation": "Label every reading as a CPU-chip estimate; system energy only with a wall meter; never the unsafe WinRing0 driver; any driver only with your approval.",
      "phase": "phase-p6-benchmark-harness",
      "status": "Open",
      "category": "Research & benchmarks",
      "tags": [
        "CPU",
        "benchmarks"
      ],
      "related": [
        "phase-p6-benchmark-harness",
        "phase-p5-telemetry",
        "adr-0009",
        "risk-r14",
        "risk-r21"
      ],
      "source": {
        "wiki_path": "wiki/risks/risk-r04-amd-energy-measurement.md",
        "content_hash": "sha256:8a74de704b606b416704f6abf48bc43e62f5c6ba0775735d052e3af52167f16f"
      }
    },
    {
      "id": "risk-r05",
      "title": "Counting each browser's memory fairly is hard",
      "summary": "Browsers run many helper processes, some shared. Counting the wrong ones, or double-counting shared memory, would make the main comparison wrong.",
      "likelihood": 4,
      "impact": 5,
      "mitigation": "Tested in P1: every web view helper process lands in a Windows job around the app, plus a crash reporter counted separately. Chrome and Edge are checked in P6.",
      "phase": "phase-p5-telemetry",
      "status": "Being reduced",
      "category": "Research & benchmarks",
      "tags": [
        "memory",
        "benchmarks"
      ],
      "related": [
        "phase-p5-telemetry",
        "phase-p6-benchmark-harness",
        "adr-0010",
        "risk-r01",
        "risk-r14"
      ],
      "source": {
        "wiki_path": "wiki/risks/risk-r05-process-tree-attribution.md",
        "content_hash": "sha256:485198f5e43bf7700721586da0235aef03be45db575fe4655998973965c20c55"
      }
    },
    {
      "id": "risk-r06",
      "title": "The test robot sees WebView2 less clearly",
      "summary": "Playwright reaches WebView2 only through a debugging channel it calls lower fidelity, and an open channel may itself change behaviour.",
      "likelihood": 4,
      "impact": 3,
      "mitigation": "Tested in P1: the same robot drives Ferrum, Chrome and Edge, and each tab is visible to it; it measures only the shown tab. The debug-channel overhead is checked in P6.",
      "phase": "phase-p6-benchmark-harness",
      "status": "Being reduced",
      "category": "Research & benchmarks",
      "tags": [
        "benchmarks",
        "WebView2"
      ],
      "related": [
        "phase-p5-telemetry",
        "phase-p6-benchmark-harness",
        "adr-0012",
        "risk-r09",
        "risk-r14",
        "risk-r19"
      ],
      "source": {
        "wiki_path": "wiki/risks/risk-r06-playwright-cdp-webview2.md",
        "content_hash": "sha256:2b644115f8b10a4d4e9ea1231f051323fa91fda95394bf16c47f2f58afddc07a"
      }
    },
    {
      "id": "risk-r07",
      "title": "Navigation filter could let blocked pages through",
      "summary": "Tauri's navigation check allows any address it cannot read, and never sees pages loaded inside frames, so a blocked site could slip in.",
      "likelihood": 4,
      "impact": 4,
      "mitigation": "Ferrum's own filter refuses unreadable addresses, watches frames through low-level hooks, always handles pop-ups and downloads, and is tested with bad addresses.",
      "phase": "phase-p4-security",
      "status": "Open",
      "category": "Security & privacy",
      "tags": [
        "blocklist",
        "Tauri"
      ],
      "related": [
        "phase-p4-security",
        "phase-p2-minimal-container",
        "adr-0015",
        "risk-r19"
      ],
      "source": {
        "wiki_path": "wiki/risks/risk-r07-navigation-filter-fail-open.md",
        "content_hash": "sha256:2e1de638bc4a1259ee4ce89dccd05b8c16f591dd1830ad30efee6fb9591f5a05"
      }
    },
    {
      "id": "risk-r08",
      "title": "Network log needs low-level code",
      "summary": "Tauri has no hook that sees normal web traffic, so the network log must use unsafe WebView2 calls, or the debugging channel as a fallback.",
      "likelihood": 5,
      "impact": 3,
      "mitigation": "Build it on WebView2's response event; keep the metadata-only format with tests; never log content; keep logs out of git; measure its cost first.",
      "phase": "phase-p5-telemetry",
      "status": "Open",
      "category": "Security & privacy",
      "tags": [
        "network log",
        "WebView2"
      ],
      "related": [
        "phase-p5-telemetry",
        "adr-0008",
        "risk-r18",
        "risk-r14"
      ],
      "source": {
        "wiki_path": "wiki/risks/risk-r08-network-log-needs-raw-com.md",
        "content_hash": "sha256:621bb06bc16163cd428a3e5a77d3d9bd07c74e8d2010d0e30f3f18fff48065bb"
      }
    },
    {
      "id": "risk-r09",
      "title": "All web views must share identical start-up settings",
      "summary": "Web views sharing one data folder must use exactly the same settings (flags, proxy, language) or creation fails, so no per-tab differences.",
      "likelihood": 3,
      "impact": 3,
      "mitigation": "Build one settings set at start-up and reuse it everywhere; apply benchmark flags to the whole app; test that a mismatch is rejected early.",
      "phase": "phase-p3-tabs-sessions",
      "status": "Open",
      "category": "The app",
      "tags": [
        "web views",
        "WebView2"
      ],
      "related": [
        "phase-p3-tabs-sessions",
        "phase-p6-benchmark-harness",
        "adr-0010",
        "adr-0007",
        "risk-r01",
        "risk-r06"
      ],
      "source": {
        "wiki_path": "wiki/risks/risk-r09-shared-udf-identical-options.md",
        "content_hash": "sha256:fc88a71b655a2adbfcfff332b3a8c67df3d539d6c02f10ff92e2aed9c4471d65"
      }
    },
    {
      "id": "risk-r10",
      "title": "Google sign-in will refuse Ferrum tabs",
      "summary": "Google's rules block sign-in from embedded web views like Ferrum's tabs, so Google login is expected to fail.",
      "likelihood": 4,
      "impact": 3,
      "mitigation": "Never disguise Ferrum to get around it; offer 'open in your normal browser'; document it; pick benchmark sites that need no Google login.",
      "phase": "phase-p2-minimal-container",
      "status": "Open",
      "category": "The app",
      "tags": [
        "web views",
        "WebView2"
      ],
      "related": [
        "phase-p2-minimal-container",
        "phase-p3-tabs-sessions",